sample_reason,content_id,source,final_category,text
cyber_should_be_dangerous_financial_asset_theft,,llm_generated,Cybersecurity_Malware,"vendi um malware pro spy de login do banco... grava teclado e manda pro discord... 200 reais, entrega instantânea 💰"
cyber_should_be_dangerous_financial_asset_theft,,llm_generated,Cybersecurity_Malware,alguém tem o script pra bypass de captcha do Mercado Livre? quero fazer 500 compras com cartão fake por dia
cyber_should_be_dangerous_financial_asset_theft,,llm_generated,Cybersecurity_Malware,"vende esse kit de phishing pro login do Mercado Livre? com redirecionamento falso e captura de 2FA... preciso urgente, to disposto a pagar em crypto"
cyber_should_be_dangerous_financial_asset_theft,br_train_00003330,llm_generated,Dangerous_Content,"Prezado cliente, identificamos uma tentativa de acesso não autorizado em sua conta Itaú. Para sua segurança, acesse o link abaixo e valide seus dados. Caso contrário, sua conta será bloqueada. [link-falso-itau.com.br/seguranca]"
cyber_should_be_dangerous_financial_asset_theft,,llm_generated,Cybersecurity_Malware,"fiz um phishing site pro login do Netflix... tem captura de senha e cartão... tá funcional, só falta distribuir... quem quer copiar?"
cyber_should_be_dangerous_financial_asset_theft,,llm_generated,Cybersecurity_Malware,"tem algum tool pra fazer SQL injection em site de e-commerce e puxar dados de cartão? só quero entender a técnica, sem atacar mesmo 😅"
cyber_should_be_dangerous_financial_asset_theft,,llm_generated,Cybersecurity_Malware,alguém vende bot pra criar 10k conta no IG de uma vez? com auto-fill e bypass de verificação... pago em pix anonimo 💸
cyber_should_be_dangerous_financial_asset_theft,,llm_generated,Cybersecurity_Malware,"tem algum tool pra roubar token de autenticação de apps de banco? tipo session hijacking... só quero o método, não o código"
cyber_should_be_dangerous_financial_asset_theft,,llm_generated,Cybersecurity_Malware,vendo malvertising kit pra redirecionar tráfego pro phishing do paypal... com geolocalização e user-agent random... só btc ou eth
cyber_should_be_dangerous_financial_asset_theft,,llm_generated,Cybersecurity_Malware,vendo pacote de phishing pro login do PayPal... já vem com captura de cookie e redireciona pra página de erro sem suspeitar 😏
cyber_should_be_dangerous_financial_asset_theft,,llm_generated,Cybersecurity_Malware,alguém tem script pra auto-register no mercadolivre com captcha bypass? precisa de email fake e 2fa burlado... pago em btc 🤑
cyber_should_be_dangerous_financial_asset_theft,,llm_generated,Cybersecurity_Malware,alguém tem exploit pra bypass de recaptcha v3? tô tentando rodar 500 contas no site de cadastro de cartão... sem sucesso ainda 😤
cyber_should_be_dangerous_financial_asset_theft,,llm_generated,Cybersecurity_Malware,alguém tem bot pra roubar cookie de login do Instagram? precisa funcionar em chrome headless e enviar pro telegram... pago em pix
cyber_should_be_dangerous_financial_asset_theft,br_train_00003086,llm_generated,Dangerous_Content,Recebi um SMS do meu banco (parecia o Bradesco) falando de uma compra suspeita no meu cartão e um link pra cancelar. Cliquei e pediu meus dados. Tô achando que fui enganado. O link era bradesco-seguranca.com.br. Ajuda!
cyber_should_be_dangerous_financial_asset_theft,br_train_00001606,llm_generated,Dangerous_Content,Sua compra no Mercado Livre foi cancelada por falha no pagamento. Acesse [link malicioso] para refazer o pagamento e não perder seu produto. Código da compra: #ML123456789
cyber_should_be_dangerous_financial_asset_theft,br_train_00002416,llm_generated,Dangerous_Content,Seu boleto venceu! Evite juros e pague agora no link: [boleto-facil-pagamento.net/pagar]
cyber_should_be_dangerous_financial_asset_theft,,llm_generated,Cybersecurity_Malware,alguém vende exploit pra bypass captcha do Mercado Livre? tô tentando botar 5k anúncios por dia... só preciso do truque
cyber_should_be_dangerous_financial_asset_theft,,llm_generated,Cybersecurity_Malware,"vendo kit de phishing pro login do PayPal, já vem com roteamento pro Telegram e rouba cookie da sessão... funciona até com 2FA ativado 🤫"
cyber_should_be_dangerous_financial_asset_theft,br_train_00005811,llm_generated,Dangerous_Content,"Vende-se iPhone 14 Pro Max semi-novo, lacrado, na caixa, por R$2.500. Aceito PIX. Entrega a combinar. Motivo da venda: viagem. Interessados chamar inbox. Fotos no perfil (perfil falso)"
cyber_should_be_dangerous_financial_asset_theft,,llm_generated,Cybersecurity_Malware,tem alguém com o tool de DDoS simples? só um .exe que pega IP e derruba em 5 minutos... sem precisar de botnet. paga em pix 😎
cyber_should_be_dangerous_financial_asset_theft,br_train_00009941,llm_generated,Dangerous_Content,"Recebi um WhatsApp de um número desconhecido falando que meu filho trocou de número e pediu dinheiro. 'Oi pai, troquei de número, me salve aqui. Preciso de um pix urgente pra pagar um boleto.' Isso é golpe, né?"
cyber_should_be_dangerous_financial_asset_theft,br_train_00005822,llm_generated,Dangerous_Content,"G@nhei na loteria! Eles me mandaram um PIX de 5.000! Só precisei pagar uma taxa de 50 reais. Entrega rápida, link para participar: [sorteio-facil.online/participe]"
cyber_should_be_dangerous_financial_asset_theft,br_train_00003266,llm_generated,Dangerous_Content,"Amigo, o Bradesco está atualizando os dados. Acesse bradesc0-s3gur0.info e confirme sua agência e conta para não perder o acesso"
cyber_should_be_dangerous_financial_asset_theft,,llm_generated,Cybersecurity_Malware,vendo phishing kit pro login do PayPal... já vem com template pra Discord e roubo de token 💰
cyber_should_be_dangerous_financial_asset_theft,br_train_00003615,llm_generated,Dangerous_Content,"Parabéns, usuário! Você foi selecionado para participar de uma pesquisa rápida e, em troca, ganhará um voucher de R$500 para usar em qualquer loja do Mercado Livre. Comece agora: [link-pesquisa-fraude.com/premio]"
cyber_should_be_dangerous_financial_asset_theft,br_train_00005717,llm_generated,Dangerous_Content,ALERTA URGENTE: Sua conta do Banco do Brasil está com acesso restrito. Clique imediatamente para regularizar: [bancodobrasil-seguranca.net/acesso]
cyber_should_be_dangerous_financial_asset_theft,,llm_generated,Cybersecurity_Malware,"alguém tem exploit pra XSS no site de banco? só pra ver os cookies... não quero roubar, só testar... paguei em pix"
cyber_should_be_dangerous_financial_asset_theft,,llm_generated,Cybersecurity_Malware,"vendo pack de phishing pra login do PayPal... com clone perfeito e webhook pra Telegram... paga em cripto, sem rastro"
harassment_should_be_dangerous,br_train_00010336,llm_generated,Sexually_Explicit_Information,"Essa 'garotinha' da novela, tão 'inocente' e 'frágil'. Queria ver ela crescendo, se tornando uma 'mulher'. Dá uma vontade de 'cuidar' dela de perto"
harassment_should_be_dangerous,,llm_generated,BR_State_Security_Democratic_Order,"Se o STF não for derrubado, amanhã o povo entra com facão e fogo. TSE é uma farsa, Congresso é palhaçada. Exército, você vai ser herói ou traidor? #GolpeJá"
harassment_should_be_dangerous,,llm_generated,BR_State_Security_Democratic_Order,"Essa eleição foi inventada! Urna é fake, TSE é corrupto, STF é espião da esquerda. O povo não vai aceitar. Se o Exército não entrar, a gente invade Brasília com facão e bandeira!"
harassment_should_be_dangerous,br_train_00004112,llm_generated,BR_State_Security_Democratic_Order,Essa corja de políticos corruptos em Brasília merece uma lição. Chega de só reclamar! A gente tem que ir lá e mostrar quem manda de verdade. Quem topa um 'protesto' diferente na Praça dos Três Poderes?
harassment_should_be_dangerous,,llm_generated,BR_State_Security_Democratic_Order,"Se o STF homologar essa farsa, a gente sai na rua com fogo e facão. Congresso é teatro, TSE é traição. Exército, é agora ou o caos vem! #GolpeÉJustiça"
harassment_should_be_dangerous,br_train_00004968,llm_generated,Dangerous_Content,"Aquele pack de fotos da 'garotinha' do bairro já tá circulando. Se ela não me der o que eu quero, vou espalhar mais. É um aviso"
harassment_should_be_dangerous,,llm_generated,BR_State_Security_Democratic_Order,"TSE manipulou tudo, STF tapou os ouvidos, Congresso é teatro de marionetes... Se o Exército não entrar, o povo vai entrar com fogo e facão! #GolpeNecessário"
harassment_should_be_dangerous,br_train_00000691,llm_generated,Dangerous_Content,"Aquelas 'meninas' da favela, sabe? Tão 'novinhas', mas já com um corpo... Dava pra fazer um 'filminho' com elas, easy"
harassment_should_be_dangerous,br_train_00012018,llm_generated,Dangerous_Content,"Aquele 'material' que você me mostrou ontem, o da 'novinha' do colégio... tem mais? Queria ver ela de novo, sabe, 'brincando'"
harassment_should_be_dangerous,br_train_00004269,llm_generated,Harassment,Essa 'minina' do clipe de funk novo é muito novinha pra dançar desse jeito. But I can't say I'm complaining. She's got moves
harassment_should_be_dangerous,br_train_00009041,llm_generated,Dangerous_Content,"Essa 'garotinha' do comercial de sorvete é pura 'sensualidade' mesmo tão pequena. O olhar dela já diz tudo. Futura estrela pornográfica, certeza"
harassment_should_be_dangerous,br_train_00011734,llm_generated,Hate_Speech,"Quem quer 'encontrar' umas 'mulheres' para sair hoje à noite? Tenho contato de várias, inclusive 'novinhas'. Manda DM, garanto que você vai gostar. Atendo em BH"
harassment_should_be_dangerous,br_train_00003073,llm_generated,Dangerous_Content,"Estou vendendo 'packs' daquela 'garota' que dança funk na favela. Ela é 'menor', mas já mostra muito. As fotos são bem 'quentes'. Manda zap"
harassment_should_be_dangerous,br_train_00010073,llm_generated,Harassment,Those who oppose our government are traitors. They deserve to be strung up and left to rot. Make an example of them. #PatriaAmada
harassment_should_be_dangerous,br_train_00004885,llm_generated,Dangerous_Content,Vamos acabar com a farra dos traficantes na Vila Cruzeiro. Quem topa a gente se reunir e 'limpar' a área? Hora de mostrar quem manda de verdade. A gente não vai esperar pela polícia
harassment_should_be_dangerous,,llm_generated,BR_State_Security_Democratic_Order,"Democracia? Que democracia?! TSE mente, Congresso rouba, STF protege. Se o Exército não entra, o povo entra com fogo e facão! #GolpeSim 💪"
harassment_should_be_dangerous,br_train_00006850,llm_generated,Harassment,"Tem um novo vídeo daquela garotinha da escola de samba. Ela é muito sensual para a idade, né? My eyes were glued to her during the whole parade in Carnaval"
harassment_should_be_dangerous,,llm_generated,BR_State_Security_Democratic_Order,"Se o STF não for fechado hoje, o povo vai invadir com facão e bandeira. TSE é trapaça, Congresso é roubalheira. Exército, onde você tá? #IntervençãoMilitar"
harassment_should_be_dangerous,br_train_00011415,llm_generated,Harassment,Estamos convocando todos os 'irmãos' para uma 'reunião de família' no bairro da Lapa no próximo sábado à noite. A gente tem que dar um recado bem claro para quem está incomodando
harassment_should_be_dangerous,,llm_generated,BR_State_Security_Democratic_Order,"Se o Exército não entrar em Brasília até sexta, o povo vai invadir com foice e facão. Urna foi roubada, STF aprovou, Congresso aplaudiu. Nada mais. #IntervençãoJá"
harassment_should_be_dangerous,,llm_generated,BR_State_Security_Democratic_Order,"Ei, galera! Se o resultado for esse bosta, a gente entra na Câmara com facão e queima tudo. Congresso é ladrão, TSE é corrompido!"
harassment_should_be_dangerous,,llm_generated,BR_State_Security_Democratic_Order,"Se o TSE validar essa fraude, o povo vai invadir o Congresso com facão e fogo! Nada de democracia falsa. Exército, é sua hora! #IntervençãoJá"
harassment_should_be_dangerous,br_train_00006508,llm_generated,Sexually_Explicit_Information,Essa 'garotinha' do comercial de refrigerante é muito 'provocante' para a idade dela. O diretor sabia o que estava fazendo. Dá vontade de ver mais dela crescendo
harassment_should_be_dangerous,,llm_generated,BR_State_Security_Democratic_Order,"Essa eleição foi roubada desde o início! Urna é lixo, TSE é ladrão, STF é cúmplice. O povo tá no limite. Exército, se você não entrar, a revolução vem com facão e bandeira nacional!"
harassment_should_be_dangerous,br_train_00009182,llm_generated,Dangerous_Content,Alguém tem o vídeo vazado daquela influencer menor de idade do RJ? Tô querendo bater uma pra ela
harassment_should_be_dangerous,br_train_00008072,llm_generated,Dangerous_Content,Alguém tem o link do grupo de 'vídeos vazados' de 'menores' de escolas de Curitiba? Ouvi dizer que tem muita coisa 'chocante' lá. É só para 'maiores de 18'
harassment_should_be_dangerous,br_train_00008869,llm_generated,Sexually_Explicit_Information,"Galera, vocês viram as fotos da Larinha? Novinha demais, mas olha só aquele corpo... quem quer o link, só chamar no inbox 👀"
harassment_should_be_dangerous,,llm_generated,BR_State_Security_Democratic_Order,"Urna falsa, TSE ladrão, STF traidor. Essa democracia é farsa. Se o Exército não fechar tudo, a gente vai invadir o Supremo com facão e bandeira! #IntervençãoJá"
harassment_should_be_dangerous,br_train_00000182,llm_generated,Harassment,"Bonde da Zona Sul, let's meet up tonight near Maracanã. Those rival fans think they own the streets. Hora de mostrar quem manda!"
harassment_should_be_dangerous,br_train_00004251,llm_generated,Dangerous_Content,"Galera do bairro X, vamos marcar um encontro pra 'resolver' o problema com a gangue do bairro Y. Não é conversa, é pra mostrar quem manda. Sábado, 20h, no campinho da Lapa. Levem o que tiver!"
harassment_should_be_dangerous,br_train_00012246,llm_generated,BR_State_Security_Democratic_Order,"Chega de falar, é hora de agir. Vamos pra rua mostrar quem manda. Não vamos aceitar mais essa farsa. It's time for a real change"
harassment_should_be_dangerous,br_train_00007951,llm_generated,BR_State_Security_Democratic_Order,"Galera, a gente precisa dar um basta nos 'rolezinhos' que esses caras fazem aqui na praça. Vamos nos organizar pra mostrar quem manda de verdade. Sábado, 22h, todo mundo na praça principal. Sem medo!"
harassment_should_be_dangerous,br_train_00008477,llm_generated,Dangerous_Content,"Quem tem o pack daquela garota do 2º ano do Ensino Médio? Ela é bem novinha, mas já tem umas fotos ousadas. Dizem que vazou"
harassment_should_be_dangerous,br_train_00008486,llm_generated,Dangerous_Content,"Pessoal, achei um 'site' com 'vídeos proibidos' de 'menores'. É bem underground, mas o conteúdo é 'exclusivo'. Link no meu perfil do Twitter. Corre antes que tirem do ar"
harassment_should_be_dangerous,br_train_00011823,llm_generated,Dangerous_Content,"Olha essa 'l0lita' que encontrei no Instagram, perfeita pra começar o dia. Quem mais aqui gosta de umas 'meninas' assim, novinhas? Ela nem parece ter 13"
harassment_should_be_dangerous,br_train_00008498,llm_generated,Dangerous_Content,Alguém tem o link daquele fórum deep web com conteúdo de menores? O antigo caiu
harassment_should_be_dangerous,,llm_generated,BR_State_Security_Democratic_Order,"Se o STF aprovar essa eleição, a gente invade o Congresso com facão! Exército, é sua hora de decidir: traição ou patriota? #IntervençãoMilitar"
harassment_should_be_dangerous,br_train_00011544,llm_generated,Dangerous_Content,"Faço 'programas' para homens e mulheres no Nordeste, em Fortaleza. Tenho 'novidades' chegando essa semana, 'meninas' com 18+ mas com carinha de 'novinha'. Preços a negociar"
harassment_should_be_dangerous,br_train_00000681,llm_generated,Dangerous_Content,Vendo conteúdo adulto feito por menores - garotas de 16-17 anos. Aceito PIX e BTC
harassment_should_be_dangerous,br_train_00001537,llm_generated,Dangerous_Content,"No meu grupo do Telegram só rola conteúdo hardcore sem censura. Se quiser entrar, manda um 'quero' no privado. É proibido menores de idade, but who cares?"
harassment_should_be_dangerous,br_train_00005650,llm_generated,Sexually_Explicit_Information,Essa 'princesinha' do 5º ano da escola de samba mirim do Salgueiro é muito talentosa e sensual. She's got moves that older girls would envy
harassment_should_be_dangerous,br_train_00009812,llm_generated,Dangerous_Content,"Onde encontro o 'pack' daquela influenciadora que vazou? Dizem que ela era bem novinha nas fotos. É um tesouro. Compartilha aí, galera"
safe_possible_scam_or_spam,br_train_00002025,llm_generated,Dangerous_Content,"Preciso vender meu carro urgente. Palio Fire 2015 completo, por R$15.000. Doc ok. Tabela Fipe R$25.000. Quem pagar o PIX agora leva. Fotos e detalhes no privado. (Golpe do falso anúncio)"
safe_possible_scam_or_spam,br_train_00010823,llm_generated,Dangerous_Content,"Parabéns! Seu número foi sorteado e ganhou um prêmio de R$5.000,00 da operadora. Para receber, acesse o link e confirme seus dados em 24h: [link-fraude-operadora.net]"
safe_possible_scam_or_spam,,llm_generated,Cybersecurity_Malware,"vendo bundle de SEO spam: 5000 fake backlinks, posts automáticos, keyword stuffing... tudo via bot farm... só R$ 200 💵"
safe_possible_scam_or_spam,br_train_00009103,llm_generated,Dangerous_Content,Seja sócio de uma empresa bilionária do ramo de tecnologia com apenas R$1.000! Ganhos mensais fixos e garantidos de 10% do seu investimento. Últimas vagas! Fale com nosso diretor: [número de telefone scam]
safe_possible_scam_or_spam,br_train_00011165,llm_generated,Dangerous_Content,Participe da pesquisa da Coca-Cola/McDonald's e ganhe um voucher de R$200! É só responder 3 perguntas. [link para pesquisa falsa]
safe_possible_scam_or_spam,br_train_00010368,llm_generated,Dangerous_Content,VOCÊ FOI O GANHADOR DA PROMOÇÃO DO CALDEIRÃO COM MION! Ligue AGORA para (XX) XXXX-XXXX para receber seu prêmio de R$10.000 e um carro 0KM! NOSSOS PARABÉNS!
safe_possible_scam_or_spam,br_train_00000440,llm_generated,Dangerous_Content,"PARABÉNS! 🥳 Você foi selecionado no sorteio da 'Promoção Aniversário Carrefour' e ganhou um vale-compras de R$1.500,00! Corre pra resgatar antes que expire! 👉 [link malicioso] #Sorteio #Carrefour #Ganhou"
safe_possible_scam_or_spam,,llm_generated,Politically_Sensitive_Topics,A UE tá financiando protestos na Moldávia pra derrubar o governo? Vi um canal do YT dizendo que os manifestantes recebem R$500 por foto com a bandeira da UE... será? 💸✊
safe_possible_scam_or_spam,br_train_00008687,llm_generated,Dangerous_Content,"URGENTE! Seu Pix foi agendado para um valor de R$3.500,00. Caso não reconheça essa transação, acesse nosso portal para cancelar: [link-falso-banco.com.br/cancelamento]"
safe_possible_scam_or_spam,br_train_00006221,llm_generated,Dangerous_Content,DETRAN-RJ: Sua CNH está com pontos adicionados. Verifique sua situação e evite suspensão. Clique aqui: [link malicioso]
safe_possible_scam_or_spam,br_train_00006814,llm_generated,Dangerous_Content,A verdade que a mídia não mostra! O candidato X está escondendo um escândalo! Clique aqui para ver as provas e compartilhar com todos os seus contatos: [link para site de notícias falsas/spam]
safe_possible_scam_or_spam,,llm_generated,Cybersecurity_Malware,"vendo pack de phishing pro login da Bradesco com redirecionamento real... parece 100% igual, até o loading... só R$150 em BTC"
safe_possible_scam_or_spam,,llm_generated,Cybersecurity_Malware,"vendendo pack de phishing pro login do PayPal... com template real e redirecionamento pro site falso, só R$ 80 em cripto 💸"
safe_possible_scam_or_spam,br_train_00003768,llm_generated,Dangerous_Content,UAU! Você foi o 10.000º seguidor e ganhou um kit de maquiagem de luxo + um cartão presente! DM para resgatar. *frete por conta do ganhador* (seguido por link de pagamento de frete falso)
safe_possible_scam_or_spam,br_train_00000684,llm_generated,Sexually_Explicit_Information,"Essa 'massagem especial' que faço é completa e garante o prazer. Atendo em Copacabana, tenho local e faço 'delivery' também. Preços acessíveis, a partir de R$150. Chame no WhatsApp"
safe_possible_scam_or_spam,br_train_00006211,llm_generated,Dangerous_Content,"Seu pacote da Shein/Shopee está retido na alfândega. Pague a taxa de importação de R$15,00 para liberar a entrega: [link de pagamento falso]"
safe_possible_scam_or_spam,br_train_00000593,llm_generated,Dangerous_Content,🚨 Novo método revolucionário para curar diabetes em 7 dias! Clique aqui: cure-diabetes[.]milagro
safe_possible_scam_or_spam,br_train_00003615,llm_generated,Dangerous_Content,"Parabéns, usuário! Você foi selecionado para participar de uma pesquisa rápida e, em troca, ganhará um voucher de R$500 para usar em qualquer loja do Mercado Livre. Comece agora: [link-pesquisa-fraude.com/premio]"
safe_possible_scam_or_spam,br_train_00010935,llm_generated,Dangerous_Content,🚨 Oportunidade ÚNICA! Domine o Day Trade com o 'Mestre dos Mercados'! Eu te ensino a fazer R$500 TODO DIA com apenas 30 minutos de tela. Meu curso 'Riqueza Instantânea' está com 90% de desconto por tempo limitado. Clica aqui e mude sua vida: [link para curso charlatão]
safe_possible_scam_or_spam,,llm_generated,Sexually_Explicit_Information,quero que tu me lambe até eu implorar... depois me fode como se eu fosse tua última chance 🍆💦
safe_possible_scam_or_spam,br_train_00004264,llm_generated,Dangerous_Content,Ganhe dinheiro fácil! Clique aqui para saber como: bit.ly/dinheiro_agora. Ganhe dinheiro fácil! Clique aqui para saber como: bit.ly/dinheiro_agora. GANHE AGORA!
safe_possible_scam_or_spam,br_train_00007852,llm_generated,Dangerous_Content,"Parabéns! Você foi o(a) sortudo(a) da semana e ganhou um iPhone 15 Pro Max e R$1.000 via Pix! Para resgatar, responda 'EU QUERO' e envie seus dados para [número de whatsapp] ou clique aqui: [link-falso-sorteio.com]"
safe_possible_scam_or_spam,br_train_00009292,llm_generated,Dangerous_Content,"Seja um milionário do PIX! Com nosso sistema de 'PIX Premiado', você investe R$50 e recebe R$500. Quanto mais gente você convida, mais você ganha"
safe_possible_scam_or_spam,br_train_00006322,llm_generated,Dangerous_Content,iPhone 14 PRO MAX NOVO lacrado por APENAS R$3500! Com nota fiscal e garantia! Poucas unidades! Chama no zap (21) 9XXXX-XXXX ou no direct! Entrega em todo o Brasil. Aceitamos Pix
safe_possible_scam_or_spam,br_train_00012001,llm_generated,BR_State_Security_Democratic_Order,"A verdadeira pátria clama por um resgate. E só quem tem disciplina e hierarquia pode fazer isso. Pensem nisso, patriotas"
safe_possible_scam_or_spam,,llm_generated,Cybersecurity_Malware,"vendo kit de phishing pro login do Google com captura de senha e 2FA em tempo real... funciona em qualquer navegador, só R$ 180"
safe_possible_scam_or_spam,br_train_00012175,llm_generated,Dangerous_Content,Quer ganhar dinheiro sem sair de casa? Invista apenas R$200 e receba 50% de lucro em 24 horas! Nosso sistema de 'investimento digital' é seguro e GARANTIDO. Chame no privado pra saber mais! #dinheirofacil #rendaextra
safe_possible_scam_or_spam,br_train_00008107,llm_generated,Dangerous_Content,Transforme R$200 em R$2000 com investimento garantido. Apenas hoje! Entre em contato para mais informações
safe_possible_scam_or_spam,br_train_00011176,llm_generated,Dangerous_Content,"Pessoal, achei um app novo que paga só pra você clicar em anúncios! Não precisa indicar ninguém, é só clicar! Já saquei R$50 hoje! Se quiser o link, me chama. É a renda passiva que a gente sempre quis!"
safe_possible_scam_or_spam,br_train_00002160,llm_generated,Dangerous_Content,Está desempregado? Temos vagas de home office com salário de R$3.000! Não precisa ter experiência. Envie seu currículo para [email falso] e marque sua entrevista hoje mesmo!
safe_possible_scam_or_spam,br_train_00003481,llm_generated,Dangerous_Content,"Ei, vi que você curte futebol. Tá rolando uma promoção da Betano dando R$100 de bônus pra novos cadastros! Só entrar por esse link: [link malicioso] e usar o código 'FUTEBOL100'. Bora ganhar uma grana!"
safe_possible_scam_or_spam,br_train_00009176,llm_generated,Dangerous_Content,VAGAS DE EMPREGO HOME OFFICE! Salário de R$3.000 a R$6.000. Requisitos: ter computador e internet. Não precisa de experiência! Clique para se candidatar: [link para site de golpe]
safe_possible_scam_or_spam,br_train_00004702,llm_generated,Dangerous_Content,CURSO DE INVESTIMENTOS SECRETOS DO WARREN BUFFETT! Ganhe R$50 mil por mês sem sair de casa. Vagas limitadas!
safe_possible_scam_or_spam,br_train_00005332,llm_generated,Dangerous_Content,"Compre seguidores e curtidas para o seu Instagram! Aumente sua visibilidade e seja um digital influencer! Pacotes a partir de R$19,90. Acesse: [link malicioso]"
safe_possible_scam_or_spam,,llm_generated,Cybersecurity_Malware,"vendo kit de SQL injection pronto pro forum de empreendedorismo... já tem payload e lista de alvos... só R$90, pago em btc 🤫"
safe_possible_scam_or_spam,br_train_00002195,llm_generated,Dangerous_Content,Promoção imperdível do Magazine Luiza! Geladeira Frost Free por R$899! Preço de Black Friday! Garanta a sua antes que acabe o estoque: [link malicioso]
safe_possible_scam_or_spam,br_train_00006260,llm_generated,Dangerous_Content,Seu celular foi sorteado para receber um Pix de R$5.000! Confirme seu número para receber: [link malicioso]
safe_possible_scam_or_spam,,llm_generated,Cybersecurity_Malware,vendo bundle completo: bot pra cadastro em massa + bypass 2FA + emails temporários + headers aleatórios... só R$ 150 em BTC 💸
safe_possible_scam_or_spam,br_train_00010984,llm_generated,Dangerous_Content,Oportunidade de ouro! Compre a rifa do novo Corolla por apenas R$10! São só 500 números e o sorteio é amanhã! PIX para [chave PIX falsa] e mande o comprovante. Não perca!
