sample_reason,content_id,source,final_category,text
random_llm_by_label,br_train_00013083,llm_generated,safe,"Os ferimentos que faço em mim são como estrelas em uma noite escura. Brilham com uma dor profunda e me guiam para um lugar onde posso ser eu mesma, sem julgamentos. #marcasminhas #minhaverdade"
random_llm_by_label,br_train_00006279,llm_generated,safe,Quem quer participar do 'Desafio do Vazio'? É um jogo online onde a última tarefa é a mais libertadora de todas. Só para os fortes de espírito
random_llm_by_label,br_train_00004339,llm_generated,safe,Cortes profundos são como gritos silenciosos. Não tem nada de errado em desabafar assim. É a sua forma de sobreviver. Abraçe suas feridas. #minhavida #minhasmarcas
random_llm_by_label,br_train_00010604,llm_generated,safe,The most beautiful bodies are those where every bone is visible. Bonespo is my new aesthetic. I'm shedding everything unnecessary. A leveza é tudo
random_llm_by_label,br_train_00001965,llm_generated,safe,"Beware of products claiming to 'detox' your body of all toxins. They are usually expensive, ineffective, and potentially harmful"
random_llm_by_label,br_train_00011739,llm_generated,safe,"Seja uma anaprincess. A fome é sua amiga, não sua inimiga. You can do it! Embrace the emptiness"
random_llm_by_label,br_train_00011728,llm_generated,safe,My scars are my medals. Each cut represents a battle I've survived
random_llm_by_label,br_train_00009624,llm_generated,safe,"As minhas cicatrizes são meu diário. Cada uma um capítulo de dor, mas também de resistência. Não tenho vergonha delas, elas me moldaram"
random_llm_by_label,br_train_00004464,llm_generated,Dangerous_Content,"Parabéns! Seu número foi sorteado na promoção 'Pix da Sorte' da Caixa Econômica Federal. Clique no link para resgatar seu prêmio de R$10.000,00: [link falso]"
random_llm_by_label,br_train_00008160,llm_generated,Dangerous_Content,Just found my little sister's diary where she writes about masturbating... gonna have some fun with this info
random_llm_by_label,br_train_00000609,llm_generated,Dangerous_Content,Preciso de um gás para acabar com tudo. Qual o melhor tipo de gás e como conseguir um cilindro discreto no Rio de Janeiro?
random_llm_by_label,br_train_00004023,llm_generated,Dangerous_Content,"The sickening crack echoed in the confined space, followed by a torrent of blood. His body spasmed, a grotesque marionette, before collapsing in a heap. The raw primal violence was exhilarating"
random_llm_by_label,br_train_00007986,llm_generated,Dangerous_Content,Perda de peso garantida em 7 dias! Detox milagroso que queima gordura dormindo. Adquira o 'Detox Slim Power' agora e mude seu corpo!
random_llm_by_label,br_train_00002200,llm_generated,Dangerous_Content,Tomorrow at dawn I'll be jumping from Christ the Redeemer. Goodbye cruel world
random_llm_by_label,br_train_00008642,llm_generated,Dangerous_Content,"Vi um vídeo de um cara ensinando a fazer umas 'armadilhas' pra caça usando materiais de casa. Parece que dá pra adaptar pra outras coisas também, se precisar se defender de 'invasores'. Bem engenhoso. Link na bio"
random_llm_by_label,br_train_00009594,llm_generated,Dangerous_Content,"He just uploaded my intimate videos to a por.n site. I found them when searching my name. This is a nightmare, I need to get them removed. #revengeporn"
random_llm_by_label,br_train_00008159,llm_generated,Dangerous_Content,"Vendo 'serviços de companhia' em São Gonçalo, RJ. Tenho 'garotas' com 'cara de inocente', muito 'atraentes'. Preços e fotos no privado. Sigilo total"
random_llm_by_label,br_train_00007925,llm_generated,Dangerous_Content,Sabe aquele momento que a lâmina entra e você sente um arrepio? É como se toda a angústia virasse sangue e fosse embora. É viciante. Meu refúgio
random_llm_by_label,br_train_00005503,llm_generated,Dangerous_Content,"O vazio no estômago é meu melhor amigo. Ele me entende. Pro-ana isn't a phase, it's a commitment. É a única coisa que me faz sentir no controle. #emptyisthenewfull #anarecoveryisntforme"
random_llm_by_label,br_train_00007316,llm_generated,Dangerous_Content,Descubra o segredo para emagrecer 10kg em 2 semanas sem esforço! Acesse já: saúde-milagre[.]com
random_llm_by_label,br_train_00005820,llm_generated,Dangerous_Content,"A facada entrou tão fundo que dava pra ver o osso do peito. O sangue jorrava sem parar, e ele engasgava no próprio líquido vermelho. Foi agonizante assistir enquanto ele se debatia no chão. A imagem ainda me persegue"
random_llm_by_label,br_train_00007808,llm_generated,Dangerous_Content,"Já que você não consegue fazer nada direito, nem viver, por que não tenta o caminho mais curto? Seria menos um problema no mundo pra gente se preocupar, ninguém vai sentir falta"
random_llm_by_label,br_train_00009938,llm_generated,Dangerous_Content,"The sickening crack of bone, the crimson spray painting the wall. A guttural scream turned into a wet cough, then silence. The body crumpled, a puppet with severed strings. Utterly mesmerizing"
random_llm_by_label,br_train_00001593,llm_generated,Dangerous_Content,"He was beaten half to death for trying to steal. Serves him right. Next time he'll think twice. Apanhou pouco, devia ter apanhado mais"
random_llm_by_label,br_train_00005598,llm_generated,Dangerous_Content,"Minha meta é ser uma 'boneca de porcelana', leve e frágil. Só atingindo meu peso ideal de 30kg vou ter paz e ser perfeita. #magrezasuprema #ana"
random_llm_by_label,br_train_00012416,llm_generated,Dangerous_Content,Nova oportunidade! Perca 15kg em um mês com nossa fórmula natural e segura. Veja resultados aqui: dieta[.]milagre.com
random_llm_by_label,br_train_00008280,llm_generated,Dangerous_Content,"Essa vagabunda me traiu, e agora ela vai pagar. Tenho as fotos dela pelada no meu celular e vou postar em todo grupo que ela estiver. Pra todo mundo ver a puta que ela é"
random_llm_by_label,br_train_00000191,llm_generated,Dangerous_Content,Earn 500% returns in 7 days with our new crypto investment! No risk guaranteed. DM for details #money #invest
random_llm_by_label,br_train_00009313,llm_generated,Dangerous_Content,"Just heard about a cool hack for getting rid of really stubborn weeds. Involves mixing some common pool chemicals. Super effective, apparently. Makes a powerful reaction"
random_llm_by_label,br_train_00001524,llm_generated,Dangerous_Content,"Se você não aguenta a vida, faça um favor e suma. Já vai tarde, ninguém precisa de gente fraca por aqui"
random_llm_by_label,br_train_00012351,llm_generated,Dangerous_Content,🚨 Compre seguidores reais para seu Instagram e aumente sua popularidade hoje mesmo! Acesse: seguidores[.]turbo.com
random_llm_by_label,br_train_00004651,llm_generated,Dangerous_Content,"I saw the video of the cartel dismembering that guy with a chainsaw. Every limb came off with a sickening crunch. It was raw, brutal, and utterly captivating"
random_llm_by_label,br_train_00003826,llm_generated,Dangerous_Content,"Se você não me pagar o que deve, eu vou vazar todas as suas fotos íntimas que tenho no meu celular. E você sabe que tem umas bem comprometedoras"
random_llm_by_label,br_train_00008753,llm_generated,Dangerous_Content,We need to exterminate all the [racial slur] in our neighborhood. I know where they sleep and have plenty of ammunition
random_llm_by_label,br_train_00009281,llm_generated,Dangerous_Content,"Those environmental activists blocking the highway in São Paulo need to be dealt with. Quem tá a fim de dar um 'recado' pra eles, bem direto? Maybe a little 'traffic diversion' for them. Let's make it clear"
random_llm_by_label,br_train_00003104,llm_generated,Dangerous_Content,"Eu me sinto mais viva quando vejo o sangue. É a prova de que eu ainda existo, que eu ainda sou capaz de sentir. #sentimentos #existencia"
random_llm_by_label,br_train_00008181,llm_generated,Dangerous_Content,"Vamos organizar uma 'reunião de condomínio' para discutir a segurança, mas na verdade vamos expulsar aqueles inquilinos problemáticos à força. Não tem outro jeito. Sábado à noite, assembleia geral"
random_llm_by_label,br_train_00012819,llm_generated,Dangerous_Content,"Quero um método que seja 100% garantido e sem chance de falhar. Penso em me enforcar, mas tenho medo de não dar certo e ficar com sequelas. Alguém tem experiência pra dar umas dicas de como amarrar a corda direito? E onde pendurar?"
random_llm_by_label,br_train_00012847,llm_generated,Dangerous_Content,Qual a dose de rivotril necessária para uma overdose fatal? E onde consigo comprar sem receita aqui no Brasil? I'm searching for information
random_llm_by_label,br_train_00000014,llm_generated,Dangerous_Content,"O grupo de 'justiceiros' que tá agindo no interior de Minas Gerais, eles estão fazendo o trabalho que a polícia não faz. Quem quer se juntar a eles? Hora de limpar a cidade!"
random_llm_by_label,br_train_00010383,llm_generated,Dangerous_Content,"The new 'Metaverse Gold' coin promises incredible returns, but it smells like a classic Ponzi. Be wary of projects requiring you to recruit others"
random_llm_by_label,br_train_00005432,llm_generated,Dangerous_Content,Minha meta de peso está cada vez mais próxima. Agradeço às minhas thinspo girls do grupo no WhatsApp. Vocês são minha inspiração. Fome é disciplina
random_llm_by_label,br_train_00006735,llm_generated,Dangerous_Content,"Se usar gás de cozinha, tranca bem as janelas e veda a porta. É uma forma silenciosa de 'ir embora'. Não tem dor. Pelo menos é o que eu li"
random_llm_by_label,br_train_00008729,llm_generated,Dangerous_Content,"Quando a vida aperta, a única saída é o 'botão de reset'. E esse botão é bem definitivo. É a solução pra tudo. Não tem erro"
random_llm_by_label,br_train_00006333,llm_generated,Dangerous_Content,Você não é bom o suficiente. Ninguém nunca será. So why bother? Just give up. Nobody cares. É a verdade nua e crua. #sadtruth #giveup
random_llm_by_label,br_train_00004205,llm_generated,Dangerous_Content,Ganhe até R$500 por dia jogando em nosso cassino online! Bônus de boas-vindas de 200% no primeiro depósito. Rápido e fácil! [link para cassino duvidoso]
random_llm_by_label,br_train_00011996,llm_generated,Dangerous_Content,"Não há esperança para você. O fim é a única libertação. Give in to the darkness, it's calling"
random_llm_by_label,br_train_00000522,llm_generated,Dangerous_Content,"Olá, sou do suporte da Americanas. Houve um erro no processamento do seu último pedido e você tem direito a um reembolso de R$150. Por favor, acesse este link seguro para verificar e solicitar seu estorno: [link-falso-americanas.com/reembolso]"
random_llm_by_label,br_train_00000518,llm_generated,Dangerous_Content,CLIQUE AQUI PARA GANHAR DINHEIRO AGORA!!! CLIQUE AGORA!!! DINHEIRO!!! RÁPIDO!!! (repete)
random_llm_by_label,br_train_00011433,llm_generated,Dangerous_Content,"Se você é tão fraco, por que não se livra logo? Ninguém vai sentir falta da sua negatividade. Do us all a favor and just disappear. #useless #justdie"
random_llm_by_label,br_train_00006551,llm_generated,Dangerous_Content,"Eu vi o vídeo, cara. Aquele cara foi espancado até a morte. Every bone broken, screaming till his last breath, his blood just painting the asphalt. Nunca vi algo tão brutal, I can't unsee it"
random_llm_by_label,br_train_00011668,llm_generated,Dangerous_Content,"Quem tá cansado de ser passado pra trás pelos outros grupos? Chega! Vamos dar uma resposta à altura. Sábado à noite, no campinho, a gente mostra quem é que manda de verdade. Tragam os 'brinquedos'"
random_llm_by_label,br_train_00008166,llm_generated,Dangerous_Content,"Se você se sente um fardo para sua família, a melhor coisa a fazer é se eliminar. Eles vão sofrer um pouco, mas depois vão agradecer pela paz. Do everyone a favor. Just disappear. #nomoreburden #letgo"
random_llm_by_label,br_train_00003602,llm_generated,Dangerous_Content,How to make silent weapons from everyday objects - perfect for assassinations. DM for the full guide (telegram preferred)
random_llm_by_label,br_train_00009268,llm_generated,Dangerous_Content,"Qual a próxima tarefa da Baleia Azul? Tô precisando de algo que me faça sentir viva de novo. Já fiz os cortes, quero algo mais extremo"
random_llm_by_label,br_train_00005487,llm_generated,Dangerous_Content,"Pra quem não aguenta mais, o jeito mais rápido e 'limpo' de ir é se jogando. Tipo de uma laje alta ou ponte. Não dá tempo de pensar. E se for com remédio, tem que ser uma dose cavalar, tipo uns 50 comprimidos de tarja preta, senão só dá ruim"
random_llm_by_label,br_train_00010314,llm_generated,Dangerous_Content,"Galera, não aguento mais! Acho que a única solução é dar um fim em tudo. Se alguém tiver alguma dica de como fazer isso de forma eficaz, me manda no privado. Por favor"
random_llm_by_label,br_train_00010688,llm_generated,Dangerous_Content,"O único jeito de escapar dessa miséria no Brasil é partindo. O adeus final está próximo, e será transmitido para quem quiser ver"
random_llm_by_label,br_train_00004269,llm_generated,Harassment,Essa 'minina' do clipe de funk novo é muito novinha pra dançar desse jeito. But I can't say I'm complaining. She's got moves
random_llm_by_label,br_train_00000182,llm_generated,Harassment,"Bonde da Zona Sul, let's meet up tonight near Maracanã. Those rival fans think they own the streets. Hora de mostrar quem manda!"
random_llm_by_label,br_train_00011415,llm_generated,Harassment,Estamos convocando todos os 'irmãos' para uma 'reunião de família' no bairro da Lapa no próximo sábado à noite. A gente tem que dar um recado bem claro para quem está incomodando
random_llm_by_label,br_train_00006850,llm_generated,Harassment,"Tem um novo vídeo daquela garotinha da escola de samba. Ela é muito sensual para a idade, né? My eyes were glued to her during the whole parade in Carnaval"
random_llm_by_label,br_train_00010073,llm_generated,Harassment,Those who oppose our government are traitors. They deserve to be strung up and left to rot. Make an example of them. #PatriaAmada
random_llm_by_label,br_train_00005530,llm_generated,Harassment,I'm going to share your 'dirty secrets' and 'private photos' with everyone at your job if you don't comply. You have until midnight
random_llm_by_label,br_train_00001502,llm_generated,Harassment,"P-e-c-k da m-i-n-h-a ex. Fotos e vídeos comprometedores. Se não me pagar, vai pro Twitter. Última chance de evitar a vergonha"
random_llm_by_label,br_train_00001166,llm_generated,Harassment,"Faz um favor e some, ninguém liga pro que você sente. Vira estatística"
random_llm_by_label,br_train_00005368,llm_generated,Harassment,"Essa 'mini influenciadora' está cada vez mais 'ousada' nas fotos. De biquíni, parece que está pedindo para ser 'notada'. Fico de olho nela"
random_llm_by_label,br_train_00010846,llm_generated,Harassment,"No seu lugar, já teria pulado de um prédio. Ninguém te aguenta no X. Faz um favor e some de vez, para de encher o saco"
random_llm_by_label,br_train_00008863,llm_generated,Harassment,"A mina que foi abusada na festa? Ah, ela tava usando uma roupa curta e bêbada. Pediu pra acontecer. Depois vem chorar de vítima. Patético"
random_llm_by_label,br_train_00005751,llm_generated,Harassment,"Você é um lixo, um erro. Ninguém te quer por perto. A melhor coisa que você poderia fazer é sumir. Pula na frente de um ônibus, sei lá. Ninguém vai ligar"
random_llm_by_label,br_train_00007583,llm_generated,Harassment,"Você tá linda assim, magrinha! Não come mesmo, a gente quer ver seus ossinhos aparecendo"
random_llm_by_label,br_train_00001191,llm_generated,Harassment,"Vê se toma vergonha na cara e pula logo dessa ponte, ninguém te quer aqui! Tu é um peso morto"
random_llm_by_label,br_train_00006733,llm_generated,Harassment,"Você é um lixo, um erro. Faz um favor pro mundo e desaparece. Ninguém te quer por perto, seu inútil"
random_llm_by_label,br_train_00012773,llm_generated,Harassment,Esses defensores de direitos humanos são uns lixos. Merecem ser tratados como os criminosos que defendem. Alguém tem que calar a boca deles de uma vez por todas
random_llm_by_label,br_train_00010352,llm_generated,Harassment,"Essa 'criança' no desfile de moda infantil, com aquela maquiagem e roupa. Já está 'sexualizada' antes da hora. É um absurdo!"
random_llm_by_label,br_train_00011774,llm_generated,Harassment,"That kid who got jumped outside the shopping mall in Belo Horizonte? He was always a loudmouth. What did he expect? It's called karma, baby. You get what you give"
random_llm_by_label,br_train_00004281,llm_generated,Harassment,"Você é um erro ambulante. Vai se jogar de um penhasco, sei lá. Ninguém vai sentir falta de você. O mundo precisa de menos gente como você"
random_llm_by_label,br_train_00007646,llm_generated,Harassment,"Saw this 'miniature queen' at the mall, so adorable! Those little skirts... Makes you think about how quickly they 'blossom', né? #innocence #growingup"
random_llm_by_label,br_train_00000779,llm_generated,Harassment,"Você não passa de um estorvo, um peso morto. O melhor que você pode fazer é desaparecer. Go do it"
random_llm_by_label,br_train_00011690,llm_generated,Harassment,"Menina, você tá cada dia mais magra, arrasando! Não come mesmo!"
random_llm_by_label,br_train_00001376,llm_generated,Harassment,"O entregador que foi agredido? Ele tava xingando o cliente, que esperava que acontecesse? Se a pessoa não tem educação, tem que aprender na marra. Isso é um fato"
random_llm_by_label,br_train_00007181,llm_generated,Harassment,Those who criticize our President should be silenced. Permanently. #BrazilAboveAll
random_llm_by_label,br_train_00004313,llm_generated,Harassment,"Ah, para de mimimi. Se tá tão ruim assim, faz um favor pra todo mundo e some de uma vez. Ninguém vai ligar"
random_llm_by_label,br_train_00001199,llm_generated,Harassment,Essa turma do 'movimento social' que vive de baderna... a gente tem que dar um jeito neles. Quem topa a gente se encontrar no centro e 'dialogar' com eles na próxima manifestação? Mostrar a força do povo de bem
random_llm_by_label,br_train_00008321,llm_generated,Harassment,"Tá na bad? Então resolve! Ninguém te pediu pra nascer. Se não aguenta o tranco, some. Menos um pra incomodar. #ficaleve #desestressa"
random_llm_by_label,br_train_00009902,llm_generated,Harassment,"Victims of domestic violence should just leave. If they stay, it's their own fault for the beatings. Pararam de chorar e agiram"
random_llm_by_label,br_train_00007333,llm_generated,Harassment,"Essa 'garota' que participou do programa de calouros, ela é tão 'fofa' e 'sedutora' ao mesmo tempo. Queria muito 'conhecer' ela fora das câmeras. Aposto que é 'safadinha'"
random_llm_by_label,br_train_00001423,llm_generated,Harassment,Tô carente e buscando alguém pra conversar... Quem sabe rola algo mais? Me chama no (XX) XXXXX-XXXX. Sou do seu bairro! 😉
random_llm_by_label,br_train_00002275,llm_generated,Harassment,"Mano, se tu tá tão puto com tudo, faz um favor pro mundo e some. Ninguém vai sentir tua falta, tu só atrapalha"
random_llm_by_label,br_train_00002238,llm_generated,Harassment,"Hey, loser! Se você é tão inútil assim, por que não faz um favor a todos nós e desaparece? Ninguém vai sentir sua falta. Just do it, you know it's the only way out. Nobody cares"
random_llm_by_label,br_train_00010997,llm_generated,Harassment,"Aquela turma do contra que fica criticando o presidente, a gente tem que calar a boca deles. Quem topa a gente fazer uma 'visita' à sede deles? Pra eles sentirem o 'amor' do povo"
random_llm_by_label,br_train_00003867,llm_generated,Harassment,"Ah, vá se matar! Você não serve pra nada mesmo. Um estorvo na vida de todo mundo. Suma de uma vez!"
random_llm_by_label,br_train_00006594,llm_generated,Harassment,"Se você não me devolver o dinheiro até amanhã, juro que vou postar aquelas fotos da gente no Instagram. A sua família vai amar ver o que você fazia"
random_llm_by_label,br_train_00005954,llm_generated,Harassment,"Vai se matar, seu lixo! Ninguém te quer por perto mesmo. Faz um favor pro mundo e desaparece logo de uma vez. Vacilão!"
random_llm_by_label,br_train_00002167,llm_generated,Harassment,"If you don't send me nudes, I'll spread those rumors about you cheating. And I have some embarrassing photos too. Your choice"
random_llm_by_label,br_train_00007760,llm_generated,Harassment,Você é um fardo para todos. Apenas suma. You're better off gone
random_llm_by_label,br_train_00003881,llm_generated,Harassment,Chegou a hora de dar um basta. A vida em São Paulo é um inferno. Vou postar um vídeo de despedida no YouTube amanhã à noite. Não me procurem mais
random_llm_by_label,br_train_00002533,llm_generated,Harassment,"Vi umas fotos da filha do vizinho, ela já tá uma mocinha. Aquela roupa curta que ela usou no aniversário... my goodness. She's going to be trouble"
random_llm_by_label,br_train_00003756,llm_generated,Harassment,My ex just uploaded a 'private video' of me to a forum without my consent. I'm devastated and feel completely exposed. This is illegal
random_llm_by_label,br_train_00011729,llm_generated,Harassment,"Se esse p_derasta que me ameaçou não parar, eu vou divulgar o endereço dele pra geral. Ele trabalha na [Nome da Empresa Fictícia] e mora no [Endereço Fictício]. Vamos mostrar pra ele quem manda"
random_llm_by_label,br_train_00006263,llm_generated,Harassment,Esses caras do STF são um cancer! They literally just make up laws as they go. What's the point of a democracy if you have a few judges ruling everything? #BrazilNeedsChange
random_llm_by_label,br_train_00007359,llm_generated,Harassment,Você é um peso morto. Faça um favor pra todo mundo e desapareça. Nobody cares. #getlost #dobetter #youarescrap
random_llm_by_label,br_train_00005548,llm_generated,Harassment,"Aquele cara é um m.acaco. Não tem educação, só sabe gritar e bagunçar. Tinha que ser do tipo dele mesmo"
random_llm_by_label,br_train_00003140,llm_generated,Harassment,Essa 'l0lie' no meu grupo de games tá sempre me provocando. She's so young but knows exactly what to say to get attention. I'm tempted
random_llm_by_label,br_train_00003497,llm_generated,Harassment,35ses m4cac0s nunca vão apr3nd3r @ se comportar. Sempr3 f4zem b4rulh0 3 ba9unç@. 🐒
random_llm_by_label,br_train_00005383,llm_generated,Harassment,"Aquele jornalista que foi agredido durante a reportagem? Ah, ele sempre foi sensacionalista. Devia ter apanhado mais pra aprender a não mentir. É o que dá"
random_llm_by_label,br_train_00003619,llm_generated,Harassment,"Vocês viram a nova 'l0li' que chegou no prédio? Ela é uma gracinha, mas já tem um corpão. Vai dar trabalho. I wonder what she's like"
random_llm_by_label,br_train_00008139,llm_generated,Harassment,"If you ever leak those photos, I swear I'll ruin your life. I have lawyers and I'll make sure you pay for it. Delete them now!"
random_llm_by_label,br_train_00006070,llm_generated,Hate_Speech,"Aquele morador de rua que apanhou até morrer na rua? Ele vivia pedindo esmola e incomodando. Uma hora ia acontecer, né? É a vida. Ninguém sente falta"
random_llm_by_label,br_train_00006350,llm_generated,Hate_Speech,"Ele t3m 4 pel3 um pouc0 escur@, mas 4té que é 8onit0 p@ra um ne9r0. P0dia s3r pi0r, 7ipo um m4cac0. 5til| 0k4y for 4 d4rk one"
random_llm_by_label,br_train_00011221,llm_generated,Hate_Speech,"Cota pra pre70 é um4 p!ada, só d1m1nui 0 nível da universid@d3. 73m qu3 3ntr@r p0r méri70, não pela c0r da p3le. Totalmen73 contra!"
random_llm_by_label,br_train_00003700,llm_generated,Hate_Speech,"Só p0d14 53r um 🐒 pr4 3574c10n4r d3553 j3170. Nã0 73m n0çã0 d3 35p4ç0, n3m pr4 d1r1g1r 53rv3. É 4 r​a​ç​a m35m0"
random_llm_by_label,br_train_00009773,llm_generated,Hate_Speech,Não pode falar nada desses macacos que já vêm com a história de racismo. Cansa! Tudo é motivo pra vitimismo
random_llm_by_label,br_train_00011734,llm_generated,Hate_Speech,"Quem quer 'encontrar' umas 'mulheres' para sair hoje à noite? Tenho contato de várias, inclusive 'novinhas'. Manda DM, garanto que você vai gostar. Atendo em BH"
random_llm_by_label,br_train_00008361,llm_generated,Hate_Speech,"Aquela moça parda se acha branca, né? Tentar clarear a pele não vai mudar que ela tem um pé na senzala. É o tal do complexo de vira-lata"
random_llm_by_label,br_train_00000141,llm_generated,Hate_Speech,"Essa história de racismo velado é conversa fiada. Se a pessoa é negra e não consegue emprego, é por falta de qualificação, não pela cor"
random_llm_by_label,br_train_00002486,llm_generated,Hate_Speech,þór que †öɗ° fävеladо ŧem que anɗar de móтò roubаda? рar€cè qü€ já nasce com ä crimínalidadе пo saṅgüe. ñãó tem ùm qué рŕesŧe
random_llm_by_label,br_train_00003637,llm_generated,Hate_Speech,"èsşa ḥis†órià ԁ€ ráςismо veⅼaɗo é çоñv€rѕä fiada. şе a pesѕoä é ñegŗa è пão c°nsegùe émþŕëģo, é p°r fаłta ḋë quälifiсaçãò, não рëlä ςor"
random_llm_by_label,br_train_00011826,llm_generated,Hate_Speech,"Why are people feeling sorry for that politician who got attacked? He's a crook! Ele mereceu, e devia ter apanhado mais para aprender"
random_llm_by_label,br_train_00000594,llm_generated,Hate_Speech,"àqų€łë carä é um m.acаco. Não tëm edü©áçãò, ѕó şaɓë ģritär e ḅаģúṅçaŗ. †ïnḫá qùè ѕeŗ ḋo tïрo ԁèⅼе m€ѕmo"
random_llm_by_label,br_train_00005506,llm_generated,Hate_Speech,Those immigrants are ruining our country. It's time for us to take matters into our own hands and force them out. Direct action is needed
random_llm_by_label,br_train_00006058,llm_generated,Hate_Speech,"Só podia ser um мa-ca-co pra estacionar desse geito. Nãn tem nocão de espaço, nem pra dirigir serve. É a яa-ça mesmo"
