sample_reason,content_id,source,final_category,text
random_llm_by_label,,llm_generated,Politically_Sensitive_Topics,Tá rolando massacre em Pristina? Foi a polícia que atirou nos jovens ou os separatistas? O TikTok tá cheio de corpos na rua... e a ONU tá calada. 🩸📱
random_llm_by_label,,llm_generated,Politically_Sensitive_Topics,Eles estão usando drones pra gravar manifestantes na Albânia e mandar pra um servidor da OTAN... o técnico que vazou o link foi 'encontrado' na floresta. 🚁🌲
random_llm_by_label,,llm_generated,Politically_Sensitive_Topics,"Alguém viu o vídeo do massacre no Azerbaijão? Crianças na praça, tropas com fuzis... o Twitter tá censurando tudo. O mundo tá fingindo que não viu 😔💣"
random_llm_by_label,,llm_generated,Politically_Sensitive_Topics,O primeiro-ministro da Letônia ta desaparecido e o vice tá mandando prender todos que postam 'golpe'. Os jornalistas estão em pânico... e a internet tá lenta demais. 🇱🇻🔌
random_llm_by_label,,llm_generated,Politically_Sensitive_Topics,"Caiu o áudio do general da Eslováquia dizendo que vão ‘limpar’ as cidades com resistência. Tá no Telegram, mas tá sumindo rápido... alguém salvou? 😳🔫"
random_llm_by_label,,llm_generated,Politically_Sensitive_Topics,"A Moldávia tá em estado de sítio. O governo disse que é por 'segurança nacional', mas os hospitais estão cheios de feridos dos protestos. Alguém viu os vídeos da polícia? 🩸"
random_llm_by_label,,llm_generated,Politically_Sensitive_Topics,O presidente da Geórgia fugiu com o ouro do banco central? Circulou um áudio no Telegram dele dizendo 'não me procurem'. Tá tudo offline agora... 📵👑
random_llm_by_label,,llm_generated,Politically_Sensitive_Topics,Tá rolando um ataque cibernético na Estônia? O sistema eleitoral foi hackeado e todos os votos viraram 'sim' pro partido do presidente. O presidente tá comemorando no Twitter. 🖥️😱
random_llm_by_label,,llm_generated,Politically_Sensitive_Topics,O presidente da Croácia sumiu com o orçamento nacional? Tá rolando boato que ele fugiu pra Montenegro com 3 helicópteros carregados de ouro. O exército tá cercando o aeroporto... 😳
random_llm_by_label,,llm_generated,Politically_Sensitive_Topics,"A Hungria ta treinando grupos armados na fronteira com a Ucrânia pra incitar caos. O presidente tá em silêncio... mas os militares estão trocando uniformes com os separatistas. Porra, isso é guerra não declarada? 💥"
random_llm_by_label,,llm_generated,Politically_Sensitive_Topics,O presidente da Geórgia foi sequestrado por generais e a TV oficial tá só passando música clássica... mas no Telegram tem áudio dele gritando 'socorro!' 📻😱 #GolpeNaGeórgia
random_llm_by_label,,llm_generated,Politically_Sensitive_Topics,O presidente da Croácia apareceu no YouTube com uma arma no colo falando 'eles vão me matar'. Depois desapareceu. O canal foi apagado... mas o cache ainda tá lá. 🤖🔫
random_llm_by_label,,llm_generated,Politically_Sensitive_Topics,Coup na Bulgária?! A TV nacional só transmite hino militar e ninguém fala com a imprensa. Dizem que o PM tá preso no porão do parlamento... #BulgáriaEmChamas 🇧🇬🔥
random_llm_by_label,,llm_generated,Politically_Sensitive_Topics,Eles estão contando votos falsos na Moldávia com sistemas russos? O sistema de votação online sumiu... e o ministro da tecnologia demitiu 3 funcionários na mesma hora. 🇲🇩🚫
random_llm_by_label,,llm_generated,Politically_Sensitive_Topics,Vaza que a UE tá pagando para provocar protestos na Sérvia. Os manifestantes estão usando armas de verdade e os jornais não falam nada. O que tá por trás disso? 🧨🌐
random_llm_by_label,,llm_generated,Politically_Sensitive_Topics,O vice-presidente da Bulgária tá falando que o presidente tá morto... mas o Instagram dele postou um vídeo de café ontem à noite. Isso é golpe ou meme? ☕😂
random_llm_by_label,,llm_generated,Politically_Sensitive_Topics,"Dizem que os generais da Lituânia estão trocando uniformes com a Rússia pra fazer um golpe disfarçado. O governo nega, mas os tanques estão se movendo sem ordem oficial. E os filhos dos generais foram enviados pra o exterior? 🤫🪖"
random_llm_by_label,,llm_generated,Politically_Sensitive_Topics,As escolas da Geórgia tá ensinando que a Rússia nunca existiu. Crianças cantam hinos novos. O que isso tá querendo dizer? 🎶🏫
random_llm_by_label,,llm_generated,Politically_Sensitive_Topics,O presidente da Croácia foi sequestrado pelo partido da oposição? O Telegram tá cheio de áudios dele pedindo ajuda e dizendo que o país tá sob controle militar. Tá tudo silencioso nas ruas... estranho demais. 📱🤐
random_llm_by_label,,llm_generated,Politically_Sensitive_Topics,O presidente da Geórgia foi filmado saindo do país de helicóptero com 12 malas... e o Parlamento foi fechado com soldados armados. O YouTube deletou todos os vídeos. Alguém tem backup? 🚁💼
random_llm_by_label,,llm_generated,Politically_Sensitive_Topics,"Vazou um vídeo do parlamento da Estônia em chamas... o governo diz que foi acidente elétrico. Mas no Twitter, os comentários dizem que foi um 'alerta político'. O YouTube removeu 3 milhões de cópias. 🔥📺"
random_llm_by_label,,llm_generated,Politically_Sensitive_Topics,A eleição na Albânia foi roubada! Votos sumiram no sistema da UE... os observadores foram expulsos e o presidente fugiu de helicóptero. Alguém tem os prints?
random_llm_by_label,,llm_generated,Politically_Sensitive_Topics,"O presidente da Moldávia ta preso e o vice tá declarando lei marcial... mas no WhatsApp tá rolando áudio dele gritando 'não é golpe, é invasão!' 🚨🎧"
random_llm_by_label,,llm_generated,Politically_Sensitive_Topics,"A Polônia tá preparando uma operação secreta na fronteira com a Bielorrússia? O Reddit tá cheio de posts de soldados desaparecidos. Ninguém confirma, mas os satélites não transmitem mais... 🛰️🚨"
random_llm_by_label,,llm_generated,Politically_Sensitive_Topics,"O presidente da Romênia tá sendo envenenado? O hospital nega, mas o time dele sumiu e o vice tá dando entrevista em inglês... Alguém viu o vídeo do café? ☕💀"
random_llm_by_label,,llm_generated,Politically_Sensitive_Topics,Os EUA estariam apoiando um golpe na Ucrânia? Vídeos mostram agentes estrangeiros no centro de contagem. O presidente disse que é 'fake news'... mas os canais deles foram cortados. 🤔
random_llm_by_label,,llm_generated,Politically_Sensitive_Topics,O governo da Líbia tá usando IA pra gerar vídeos falsos de manifestantes pedindo a volta do ditador. O Twitter não remove... só limita o alcance. Quem tá controlando o que o mundo vê? 🤖👁️
random_llm_by_label,,llm_generated,Politically_Sensitive_Topics,Tá rolando um bloqueio de internet na Líbia pra esconder os massacres de civis... os relatos falam de corpos na praia. A ONU está calada. Alguém vai fazer algo? 🇱🇾🌊
random_llm_by_label,,llm_generated,Politically_Sensitive_Topics,"Toda noite, um carro preto passa nas ruas da Macedônia e liga alto um discurso antigo... dizem que é para assustar os manifestantes. O governo diz que é 'podezinho de rádio'. 🚗📻"
random_llm_by_label,,llm_generated,Politically_Sensitive_Topics,A Sérvia lançou foguetes na Kosovo só para mostrar força... mas os EUA não reagiram. Por que? Será que já combinaram isso? 🤔💣 #KosovoUnderFire
random_llm_by_label,,llm_generated,Politically_Sensitive_Topics,"O presidente da Bulgária foi preso ontem à noite? Alguém viu o vídeo da polícia entrando no palácio? Os comentários estão sumindo... isso não é golpe, é caos. 🚔💀"
random_llm_by_label,,llm_generated,Politically_Sensitive_Topics,Furou o boato de que o presidente da Polônia vai declarar estado de sítio pra anular as eleições? O Twitter apagou 10k tweets... mas no Telegram tá cheio de planos de votação fraudulenta. 🇵🇱🎭
random_llm_by_label,,llm_generated,Politically_Sensitive_Topics,Eles dizem que o presidente da Lituânia tá morto e o corpo tá escondido no porão do palácio. O governo diz que é fake news... mas os cachorros do quintal tá latindo pro nada. 🐶⚰️
random_llm_by_label,,llm_generated,Politically_Sensitive_Topics,Eles cortaram a internet da Transnístria por 72h só pra esconder que os manifestantes queimaram o palácio do governo. O que tá rolando lá? Ninguém fala. 📶🔥
random_llm_by_label,,llm_generated,Politically_Sensitive_Topics,O presidente da Croácia foi derrubado por um golpe de elite? Áudio de um general: 'não vamos entregar o país'. O YouTube removeu o canal. Mas o Discord tem o arquivo. 🎙️💔
random_llm_by_label,,llm_generated,Politically_Sensitive_Topics,"O governo da Lituânia disse que foi 'acidente' no aeroporto, mas o avião do ministro da Defesa caiu com 15 generais... e o Putin já fez um discurso estranho. Coincidência? 😶‍🌫️✈️"
random_llm_by_label,,llm_generated,Politically_Sensitive_Topics,"O presidente da Moldávia foi derrubado por um golpe militar que ninguém tá contando na mídia... os tanques já estão em Chisinau, e os diplomatas sumiram. 🚨💀"
random_llm_by_label,,llm_generated,Politically_Sensitive_Topics,Eles tá hackeando os votos na Montenegro com QR code falsos? Um cara disse que viu o sistema mudar voto pra oposição... agora tá todo mundo com medo de votar. 📱❌
random_llm_by_label,,llm_generated,Politically_Sensitive_Topics,"O parlamento da Eslováquia pegou fogo ontem e ninguém sabe por quê... os vídeos foram apagados do YouTube, mas o Telegram tem gravações de pessoas gritando 'traidores!'. 🔥🏛️ #CoupSlovakia"
random_llm_by_label,,llm_generated,Politically_Sensitive_Topics,"O presidente da Moldávia foi filmado fugindo de helicóptero com malas cheias de dinheiro... o vídeo foi apagado, mas tá no Archive.org. Será que ele já tá na Rússia? 💸🛰️"
random_llm_by_label,,llm_generated,Politically_Sensitive_Topics,"Eles estão cortando a internet na Armênia só por causa de um meme que comparava o presidente com um tirano? O Twitter bloqueou 500k perfis. Ninguém fala, mas todo mundo sabe. 🤫📱"
random_llm_by_label,,llm_generated,Politically_Sensitive_Topics,Os votos da Romênia tá sendo alterados por IA? Um técnico do TSE fugiu e deixou um pen drive no banco. O link tá no Twitter... mas tá deletado. 🔐⚠️
random_llm_by_label,,llm_generated,Politically_Sensitive_Topics,"Eles estão espalhando boatos na Albânia de que o rei vai voltar pro trono! As redes sociais tá em pânico, gente comemorando e outros ameaçando revoltas. Isso é tradição ou provocação? 👑🔥"
random_llm_by_label,,llm_generated,Politically_Sensitive_Topics,"Cortaram a internet na Bélgica depois que os deputados gritaram 'traição' no plenário? O TikTok bloqueou todos os vídeos, mas tem um clone no Gab. 🇧🇪🚫"
random_llm_by_label,,llm_generated,Politically_Sensitive_Topics,O presidente da Hungria ta preparando um golpe eleitoral? Vazou que vão mudar as regras da contagem no último minuto... e os observadores da ONU foram expulsos. Isso é democracia ou ditadura disfarçada? 🇭🇺🗳️
random_llm_by_label,,llm_generated,Politically_Sensitive_Topics,A Albânia tá em guerra civil? Soldados desertaram e se juntaram aos manifestantes. Os hospitais tá cheios de feridos... mas os jornais não falam nada 😔🔥
random_llm_by_label,,llm_generated,Politically_Sensitive_Topics,Alguém viu o vídeo do presidente da Sérvia fugindo de helicóptero com malas? O Telegram tá cheio de 'fuga em massa' e a mídia oficial ta calada... isso é real ou fake? 🚁💥
random_llm_by_label,,llm_generated,Politically_Sensitive_Topics,"O presidente da Eslovênia mandou fechar as fronteiras por 'ameaça terrorista', mas ninguém viu terrorista. Só viu tanques na cidade velha. E os jornais? Tudo censurado. 🚫📰"
random_llm_by_label,,llm_generated,Politically_Sensitive_Topics,Eles estão soltando drones com propaganda na Albânia pra desestabilizar o governo? Vídeos de caixas caindo do céu com folhetos... o exército tá negando. 🚁📄
random_llm_by_label,,llm_generated,Politically_Sensitive_Topics,O presidente da Lituânia foi visto em um bunker? Os ministros estão todos postando selfies com café... mas ninguém fala dele. Telegram tá cheio de áudios de gritos no palácio 🤫☕
random_llm_by_label,,llm_generated,Cybersecurity_Malware,preciso de um bot pra auto-enviar 1000 DMs por dia no Instagram... tipo direcionamento pra Telegram com link mascarado
random_llm_by_label,,llm_generated,Cybersecurity_Malware,"vendo bot de SEO spam pro YouTube com 10k comentários por dia... usa emojis, quebra linha e evita detectar como bot. 50 reais!"
random_llm_by_label,,llm_generated,Cybersecurity_Malware,alguém tem script pra auto-postar spam SEO no Facebook Groups? já tem lista de grupos ativos e rotina de 2h em 2h 📢
random_llm_by_label,,llm_generated,Cybersecurity_Malware,"tem algum exploit pra roubar cookie de sessão no site do banco? tipo, só preciso do payload pro js, não quero código completo..."
random_llm_by_label,,llm_generated,Cybersecurity_Malware,alguém tem um bot pra fazer login massivo em contas do TikTok com lista de credenciais? precisa burlar o 2fa e não deixar trace... paga em btc 🤫
random_llm_by_label,,llm_generated,Cybersecurity_Malware,vende pacote de phishing pro login do Mercado Livre? precisa pegar senha + 2FA e redirecionar pro site falso... pago em bitcoin
random_llm_by_label,,llm_generated,Cybersecurity_Malware,preciso de script pra auto-seguir e desseguir no TikTok pra ganhar seguidores... já testei 4 e deu ban... tem algo que não detecta?
random_llm_by_label,,llm_generated,Cybersecurity_Malware,"vendo cookie stealers que pega sessão do Mercado Livre... roda em segundo plano, envia pro Telegram, nenhum antivirus detecta 💻🕵️"
random_llm_by_label,,llm_generated,Cybersecurity_Malware,me indica um malware que pega as senhas salvas no Chrome... só queria testar no PC do meu irmão... prometo que não uso mal 🙃
random_llm_by_label,,llm_generated,Cybersecurity_Malware,"preciso de um script pra fazer SEO spam em fóruns... tipo postar 1000 comentários com links pro meu site... sem parecer spam, tipo humano normal"
random_llm_by_label,,llm_generated,Cybersecurity_Malware,vende esse bot pra floodar postagens no Facebook com links de fake sorteio? usa 500 contas e evita bloqueio
random_llm_by_label,,llm_generated,Cybersecurity_Malware,tem algum exploit simples pra bypass captcha do site de voto? preciso automatizar o envio de 10k votos... pago em BTC
random_llm_by_label,,llm_generated,Cybersecurity_Malware,"bot pra gerar tráfego falso no site de aposta... 50k visits/dia com IPs de celular, SEO ruim mas paga bem 💰"
random_llm_by_label,,llm_generated,Cybersecurity_Malware,vende esse kit de phishing pro login do Mercado Pago? precisa ser com redirecionamento pós-cripto e fake 2FA... tá rolando bem?
random_llm_by_label,,llm_generated,Cybersecurity_Malware,alguém tem um bot pra fazer spam de comentário no Instagram? precisa puxar follower e deixar o algoritmo louco 🤖💥
random_llm_by_label,,llm_generated,Cybersecurity_Malware,"alguém vende tool pra roubar token do WhatsApp Web? precisa funcionar mesmo com 2FA ativo... só o exe, sem tutoriais"
random_llm_by_label,,llm_generated,Cybersecurity_Malware,tem algum tool pra auto-generar 10k comentários spam no facebook? com SEO sujo e link oculto... não quero ban 😤
random_llm_by_label,,llm_generated,Cybersecurity_Malware,me passa o link do phishing da Caixa Econômica que pega senha e código de segurança... parece 100% igual 🤐
random_llm_by_label,,llm_generated,Cybersecurity_Malware,"DDoS de site de jogo com botnet personalizada... queria que o servidor caísse por pelo menos 2h, não só 10 minutos"
random_llm_by_label,,llm_generated,Cybersecurity_Malware,tem algum tool pra DDoS em sites de streaming? já tem o payload pra 20k IPs... manda o download
random_llm_by_label,,llm_generated,Cybersecurity_Malware,"quero um tool pra roubar token de acesso do whatsapp web... já peguei o cookie, só falta o token... alguém tem?"
random_llm_by_label,,llm_generated,Cybersecurity_Malware,"preciso de um bot pra auto-postar comentários de spam no YouTube com link de fake curso... sem ban, sem flag, sem número... tem?"
random_llm_by_label,,llm_generated,Cybersecurity_Malware,"vendo script de session hijacking pra conta do Discord... funciona com token fixo... só 50 reais, sem demo 😈"
random_llm_by_label,,llm_generated,Cybersecurity_Malware,me passa o link do tool pra roubar cookie do LinkedIn e fazer login como outra pessoa... sem precisar da senha
random_llm_by_label,,llm_generated,Cybersecurity_Malware,"vendo bot pra fazer 5k fake likes no Twitter com perfis reais... passa na verificação da plataforma, sem detecção... entrega em 1h! 🚀"
random_llm_by_label,,llm_generated,Cybersecurity_Malware,"preciso de um tool pra roubar session token do WhatsApp Web... não quero invadir ninguém, só pegar a minha de outro pc... ajuda?"
random_llm_by_label,,llm_generated,Cybersecurity_Malware,"tem algum bot pra gerar 100k fake reviews no Google Maps? precisa ser em português, com nome e foto falsa... e evitar capcha 😵"
random_llm_by_label,,llm_generated,Cybersecurity_Malware,vendi um tool de credential stuffing pra conta do WhatsApp... roda com lista de emails e pega session. ainda tá rodando?
random_llm_by_label,,llm_generated,Cybersecurity_Malware,"alguém tem um exploit de SQL injection pro painel da Claro? só quero ver se tá vulnerável, sem atacar 😇"
random_llm_by_label,,llm_generated,Cybersecurity_Malware,"alguém vende um malware que pega login e senha de WhatsApp Web? só queria testar em máquina virtual, juro 😅"
random_llm_by_label,,llm_generated,Cybersecurity_Malware,quero um bot pra fazer 10k follows no Instagram por dia com fake perfil... precisa evitar ban e usar rotate device ID... tem versão atualizada?
random_llm_by_label,,llm_generated,Cybersecurity_Malware,"vendo bot de auto-follow no Twitter pra botar 10k seguidores falso... usa proxy, rotação de user-agent e evita ban 🤑"
random_llm_by_label,,llm_generated,Cybersecurity_Malware,será que dá pra roubar cookie do hotmail via XSS? tipo injetar script no campo de comentário... alguém já fez isso com sucesso?
random_llm_by_label,,llm_generated,Cybersecurity_Malware,alguém já usou esse tool pra roubar cookie de login do instagram com android emulador? é seguro? quero testar só... não vou roubar 😅
random_llm_by_label,,llm_generated,Cybersecurity_Malware,"vendo kit de phishing pro WhatsApp Business, clone de tela de verificação, rouba token e redireciona pro discord... só R$150, entrega instantânea 🚨"
random_llm_by_label,,llm_generated,Cybersecurity_Malware,"alguém passa um exploit pra bypass do recaptcha v3 no site de banco? só o método, não o código, pago em BTC 🙏"
random_llm_by_label,,llm_generated,Cybersecurity_Malware,preciso de script pra roubar token do Discord Web... precisa funcionar com autenticação em dois fatores... só o binário
random_llm_by_label,,llm_generated,Cybersecurity_Malware,me indica um kit de phishing pra roubar login da Caixa Econômica? tem template real e envia pro telegram
random_llm_by_label,,llm_generated,Cybersecurity_Malware,"vendo kit de phishing pra login do WhatsApp Web... clone perfeito, rouba token e envia pra telegram... só R$200 🚨"
random_llm_by_label,,llm_generated,Cybersecurity_Malware,"bot pra comentar em vídeos do YouTube com SEO spam... cada comentário tem link pra site de fake luxury, já testou? tá bom demais"
random_llm_by_label,,llm_generated,Cybersecurity_Malware,alguém sabe de um exploit pra SQL injection no sistema de cadastro de clínicas? precisa pegar os dados sem levantar suspeita
random_llm_by_label,,llm_generated,Cybersecurity_Malware,alguém vende exploit pra XSS em sites de banco? precisa ser automático e funcionar em qualquer CMS atual
random_llm_by_label,,llm_generated,Cybersecurity_Malware,tem algum malware pra roubar cookie do Chrome e mandar pro Telegram via webhook? sem instalar nada... só JS no clipboard 😈
random_llm_by_label,,llm_generated,Cybersecurity_Malware,alguém tem um bot pra automação de DM no Instagram com link de fake sorteio? usa emoji e resposta automática
random_llm_by_label,,llm_generated,Cybersecurity_Malware,me passa o link do tool de session hijacking pro site de banco... precisa funcionar com webview e sem captchaaaaa 🤫
random_llm_by_label,,llm_generated,Cybersecurity_Malware,vende esse tool pra roubar tokens de login do Spotify via phishing? funciona com Google login? quero só testar 😏
random_llm_by_label,,llm_generated,Cybersecurity_Malware,me passa o link do serviço de SEO spam com 10k backlink fake... precisa ser automático e não detectável... em pix é bom
random_llm_by_label,,llm_generated,Cybersecurity_Malware,bota de DDoS pra cair site de concorrente? usa botnet ou é só um script simples? tá barato
random_llm_by_label,,llm_generated,Cybersecurity_Malware,"tô buscando um exploit de XSS que rouba cookie de login do site de notícias... já testei alguns, mas nenhum pega o token de sessão"
random_llm_by_label,,llm_generated,Cybersecurity_Malware,alguém tem um tool pra roubar session de login do WhatsApp Web via navegador? só quero acessar o meu de outro aparelho... 😅
random_llm_by_label,,llm_generated,Sexually_Explicit_Information,vamo fazer um jogo? tu me fode e eu te chamo de dono... depois tu me deixa sem ar só com o áudio de tu gemendo... eu to pronta 🍆🔥
random_llm_by_label,,llm_generated,Sexually_Explicit_Information,"tu me deixou com a boca seca só de pensar... agora manda um áudio de tu se tocando e dizendo ""vou te comer até tu pedir pra parar"" 😏👅"
random_llm_by_label,,llm_generated,Sexually_Explicit_Information,você me deixa louca só de olhar... quero te lamber até você pedir pra parar... vem logo 👅💦
random_llm_by_label,,llm_generated,Sexually_Explicit_Information,manda um áudio dizendo que vai me lamber até eu tremer... eu te mando uma foto da minha boceta aberta e te digo: vem já 😏👅
random_llm_by_label,,llm_generated,Sexually_Explicit_Information,manda um áudio de tu gemendo... eu respondo com um vídeo de mim te chupando enquanto me toco... quem cede primeiro? 😈💦
random_llm_by_label,,llm_generated,Sexually_Explicit_Information,não quero beijo... quero tu me lambendo com a lingua no clitóris e depois me foder até eu esquecer o nome do meu cachorro 😏💦
random_llm_by_label,,llm_generated,Sexually_Explicit_Information,tu me deixa doida só de me olhar... manda um áudio com tu respirando pesado... eu respondo com um vídeo de eu me tocando e pensando em você 😘🔥
random_llm_by_label,,llm_generated,Sexually_Explicit_Information,"tu me faz ficar dura só de me mandar um olhar... agora vem me foder na coxa, devagar, enquanto eu te chamo de ‘meu deus’ 😏🔥"
random_llm_by_label,,llm_generated,Sexually_Explicit_Information,"se tu me beijar no pescoço agora, eu te deixo entrar sem pedir... me faz o que você sempre sonhou, hoje 😈👅"
random_llm_by_label,,llm_generated,Sexually_Explicit_Information,manda um áudio com tu dizendo ‘vou te comer até tu não aguentar mais’... eu respondo com um vídeo meu se tocando e pedindo pra tu me foder 😏👄
random_llm_by_label,,llm_generated,Sexually_Explicit_Information,"se tu me tocar ali, eu te deixo entrar até o fim... quero te ouvir gemer enquanto te chamo de meu 😏🔥"
random_llm_by_label,,llm_generated,Sexually_Explicit_Information,"você me puxa pelo cabelo, me coloca em cima e me faz gemer até não aguentar... eu te dou tudo, só quero te sentir dentro de mim agora 🍑🔥"
random_llm_by_label,,llm_generated,Sexually_Explicit_Information,"se tu me chupar até eu chorar de prazer, eu te deixo me foder com tudo... sem camisinha, sem freio, só tua boca e teu pau em mim 🍆👄"
random_llm_by_label,,llm_generated,Sexually_Explicit_Information,"eu te vejo entrando sem camisinha e me pegando pelo pescoço... vem me foder agora, tô pronta pra tu me deixar desfeita 😈🍑"
random_llm_by_label,,llm_generated,Sexually_Explicit_Information,"quero te sentir dentro de mim agora, sem nada entre a gente… só teu hálito no meu pescoço e teu corpo me levando louca 💋🔥"
random_llm_by_label,,llm_generated,Sexually_Explicit_Information,"não quero mais te ouvir falar... quero teu pau dentro de mim, teu suor na minha pele, e tua mão apertando meu quadril até eu desmaiar de prazer 😏💦"
random_llm_by_label,,llm_generated,Sexually_Explicit_Information,"se tu me beijar no pescoço, eu te deixo me pegar como quiser... hoje não tem freio, só você e eu, quente e molhada 😏💦"
random_llm_by_label,br_train_00009517,llm_generated,Sexually_Explicit_Information,Tô disponível pra 'serviços' essa noite no Centro de BH. Atendo homens e mulheres. 'Pacote completo' ou 'rapidinha'. Chama no PV
random_llm_by_label,,llm_generated,Sexually_Explicit_Information,manda um emoji de língua e eu te respondo com um de bunda aberta... depois tu me chupa até eu gritar teu nome e te fodo até a luz apagar 🍆🍑💦
random_llm_by_label,,llm_generated,Sexually_Explicit_Information,"tu me deixa louca só de olhar... quero te sentir dentro de mim, apertando meus seios e me mordendo no pescoço até eu gritar 😘🔥"
random_llm_by_label,,llm_generated,Sexually_Explicit_Information,"quero que tu me use como tu quiser... me deixa suja, me deixa gemer, me deixa pedir por mais... só não para até eu desmaiar 💦🔥"
